{
  "$schema": "https://json-schema.org/draft/2020-12/schema",
  "$id": "https://sdp.dev/specs/runtime/schemas/kubeopencode-upstream-pr-candidate-plan.schema.json",
  "title": "KubeOpenCode Upstream PR Candidate Plan",
  "type": "object",
  "required": [
    "version",
    "artifact",
    "issue_id",
    "upstream_repo",
    "maintainer_stakeholders",
    "candidate_changes",
    "acceptance_strategy",
    "first_pr_candidate",
    "explicit_exclusions"
  ],
  "properties": {
    "version": {
      "type": "string",
      "minLength": 1
    },
    "artifact": {
      "const": "kubeopencode-upstream-pr-candidate-plan"
    },
    "issue_id": {
      "type": "string",
      "pattern": "^sdp_dev-[a-z0-9]+\\.[0-9]+\\.[0-9]+$"
    },
    "references": {
      "type": "object"
    },
    "upstream_repo": {
      "type": "string",
      "pattern": "^[a-zA-Z0-9_.-]+/[a-zA-Z0-9_.-]+$"
    },
    "maintainer_stakeholders": {
      "type": "array",
      "minItems": 1,
      "items": {
        "$ref": "#/$defs/stakeholder"
      }
    },
    "candidate_changes": {
      "type": "array",
      "minItems": 1,
      "items": {
        "$ref": "#/$defs/candidate"
      }
    },
    "acceptance_strategy": {
      "type": "object",
      "required": [
        "sequence",
        "required_pr_evidence"
      ],
      "properties": {
        "sequence": {
          "type": "array",
          "minItems": 1,
          "items": {
            "type": "string",
            "minLength": 1
          }
        },
        "required_pr_evidence": {
          "type": "array",
          "minItems": 1,
          "items": {
            "type": "string",
            "minLength": 1
          }
        }
      },
      "additionalProperties": false
    },
    "first_pr_candidate": {
      "type": "object",
      "required": [
        "candidate_id",
        "title",
        "branch",
        "status",
        "traceability",
        "patch_outline"
      ],
      "properties": {
        "candidate_id": {
          "type": "string",
          "pattern": "^UP-[0-9]{3}$"
        },
        "title": {
          "type": "string",
          "minLength": 1
        },
        "branch": {
          "type": "string",
          "minLength": 1
        },
        "status": {
          "type": "string",
          "enum": [
            "prepared",
            "submitted"
          ]
        },
        "traceability": {
          "type": "object",
          "required": [
            "beads_issue",
            "compare_url",
            "submission_command"
          ],
          "properties": {
            "beads_issue": {
              "type": "string",
              "pattern": "^sdp_dev-"
            },
            "compare_url": {
              "type": "string",
              "pattern": "^https://"
            },
            "submission_command": {
              "type": "string",
              "minLength": 1
            }
          },
          "additionalProperties": false
        },
        "patch_outline": {
          "type": "array",
          "minItems": 1,
          "items": {
            "type": "string",
            "minLength": 1
          }
        }
      },
      "additionalProperties": false
    },
    "explicit_exclusions": {
      "type": "array",
      "minItems": 1,
      "items": {
        "type": "string",
        "minLength": 1
      }
    }
  },
  "additionalProperties": false,
  "$defs": {
    "stakeholder": {
      "type": "object",
      "required": [
        "group",
        "role",
        "acceptance_focus"
      ],
      "properties": {
        "group": {
          "type": "string",
          "minLength": 1
        },
        "role": {
          "type": "string",
          "minLength": 1
        },
        "acceptance_focus": {
          "type": "string",
          "minLength": 1
        }
      },
      "additionalProperties": false
    },
    "candidate": {
      "type": "object",
      "required": [
        "id",
        "name",
        "origin_gap_ids",
        "priority",
        "upstreamability",
        "scope"
      ],
      "properties": {
        "id": {
          "type": "string",
          "pattern": "^UP-[0-9]{3}$"
        },
        "name": {
          "type": "string",
          "minLength": 1
        },
        "origin_gap_ids": {
          "type": "array",
          "minItems": 1,
          "items": {
            "type": "string",
            "pattern": "^[A-Z]{2,4}-[0-9]{3}$"
          }
        },
        "priority": {
          "type": "integer",
          "minimum": 1,
          "maximum": 5
        },
        "upstreamability": {
          "type": "string",
          "enum": [
            "high",
            "medium",
            "low"
          ]
        },
        "scope": {
          "type": "object",
          "required": [
            "adds_crd_fields",
            "breaking_change",
            "requires_private_policy"
          ],
          "properties": {
            "adds_crd_fields": {
              "type": "boolean"
            },
            "breaking_change": {
              "type": "boolean"
            },
            "requires_private_policy": {
              "type": "boolean",
              "const": false
            }
          },
          "additionalProperties": false
        }
      },
      "additionalProperties": false
    }
  }
}
